### ISSUE TITLE
 problem when using  socks5

### ISSUE THREAD

**Issue by protrading104** [HavocFramework/Havoc#538]
no connection when checking. has anyone encountered this problem ? 

C2 server log error:
![image](https://github.com/user-attachments/assets/63ba3530-1d14-4981-9afb-54a7fb025e85)

socks5 settings
![image](https://github.com/user-attachments/assets/b54a97da-0fe2-43e4-8090-221c2ba56e8b)

just checking via proxychains 
![image](https://github.com/user-attachments/assets/ebc872ec-cd3c-48d5-be2e-9f7f162babef)

havoc is listening on port 3386
![image](https://github.com/user-attachments/assets/73dbc243-79cd-4cc4-b1c1-8ee42d6d43bf)

some tcpdump logs:
100.100.100.100 - HAVOC C2
100.100.100.100.3386 - socks5

 sudo tcpdump -i any port 3386 -n
tcpdump: data link type LINUX_SLL2
tcpdump: verbose output suppressed, use -v[v]... for full protocol decode
listening on any, link-type LINUX_SLL2 (Linux cooked v2), snapshot length 262144 bytes
21:48:15.072286 eth0  In  IP 200.200.200.200.7834 > 100.100.100.100.3386: Flags [SEW], seq 1577557269, win 64240, options [mss 1460,nop,wscale 8,nop,nop,sackOK], length 0
21:48:15.072334 eth0  Out IP 100.100.100.100.3386 > 200.200.200.200.7834: Flags [S.], seq 2550158612, ack 1577557270, win 64240, options [mss 1460,nop,nop,sackOK,nop,wscale 7], length 0
21:48:16.072891 eth0  In  IP 200.200.200.200.7834 > 100.100.100.100.3386: Flags [SEW], seq 1577557269, win 64240, options [mss 1460,nop,wscale 8,nop,nop,sackOK], length 0
21:48:16.072934 eth0  Out IP 100.100.100.100.3386 > 200.200.200.200.7834: Flags [S.], seq 2550158612, ack 1577557270, win 64240, options [mss 1460,nop,nop,sackOK,nop,wscale 7], length 0
21:48:17.095932 eth0  Out IP 100.100.100.100.3386 > 200.200.200.200.7834: Flags [S.], seq 2550158612, ack 1577557270, win 64240, options [mss 1460,nop,nop,sackOK,nop,wscale 7], length 0
21:48:17.113020 eth0  In  IP 200.200.200.200.7834 > 100.100.100.100.3386: Flags [.], ack 1, win 1026, length 0
21:48:17.114605 eth0  In  IP 200.200.200.200.7834 > 100.100.100.100.3386: Flags [P.], seq 1:4, ack 1, win 1026, length 3
21:48:17.114630 eth0  Out IP 100.100.100.100.3386 > 200.200.200.200.7834: Flags [.], ack 4, win 502, length 0
21:48:17.114681 eth0  Out IP 100.100.100.100.3386 > 200.200.200.200.7834: Flags [P.], seq 1:3, ack 4, win 502, length 2
21:48:17.132273 eth0  In  IP 200.200.200.200.7834 > 100.100.100.100.3386: Flags [P.], seq 4:14, ack 3, win 1026, length 10
21:48:17.175872 eth0  Out IP 100.100.100.100.3386 > 200.200.200.200.7834: Flags [.], ack 14, win 502, length 0
21:48:32.135918 eth0  Out IP 100.100.100.100.3386 > 200.200.200.200.7834: Flags [.], ack 14, win 502, length 0
21:48:32.149806 eth0  In  IP 200.200.200.200.7834 > 100.100.100.100.3386: Flags [F.], seq 14, ack 3, win 1026, length 0
